<?xml version="1.0" encoding="UTF-8"?>
<meteo xmlns="https://www.w3schools.com"
xmlns:xsi="http://www.w3.org/2001/XMLSchema-instance"
xsi:schemaLocation="https://www.w3schools.com reglas.xsd">

<poblacion>

   <prediccion> 
    <fecha></fecha>
    <tempMax></tempMax>
    <tempMin></tempMin>
    <probLluvia></probLluvia>
    <avisoRiesgo></avisoRiesgo>
   </prediccion>

</poblacion>

</meteo>
